Edge,rank,prerequisites,description,numerical effect,
Alertness,Background,,Bonus to Notice Rolls,Notice +2,
Ambidextrous,Background,,Off hand penalty ignored,,
Arcane Background (Bardic Magic),Background,,"Arcane Skill: Persuasion (Spirit)
  Starting Power Points: 10
  Starting Powers: 2
  You've learned how to channel your music into magic, using Persuasion as your arcane skill (note that Charisma is not added to Persuasion when used for casting spells). You use the Arcane Spell Failure rule when using medium or heavy armour, or large shields (i.e., if the penalty is 1 then you ignore it, but if it's 2 or 3 then it applies in full). Your spells should generally have a sound-based trapping, and unlike sorcerers and wizards you can even learn healing magic (but not Greater Healing).
",PP +10;Powers +2;Persuasion(Spirit),
Arcane Background (Magic),Background,,"Arcane Skill: Spellcasting (Smarts)
Starting Power Points: 10
Starting Powers: 3
Magicians range from powerful wizards to vile cultists. They
draw on raw supernatural energy to fuel their eldritch fires.
This energy often infuses the worlds in which they live, and
is drawn forth with elaborate rituals, words of power, runes,
or perhaps even dark sacrifices.
Wizards are often quite weak early in their careers, but are
forces to be reckoned with as they become powerful sorcerers. Backlash: When a wizard rolls a 1 on his Spellcasting die
(regardless of his Wild Die), he is automatically Shaken. This
can cause a wound.",PP +10;Powers +3;Spellcasting(Smarts),
Arcane Background (Miracles),Background,,"Arcane Skill: Faith (Spirit)
Starting Power Points: 10
Starting Powers: 2
Those who draw on miracles are priestly types or holy
champions. Their power comes from a divine presence of
some sort, including gods, nature, or spirits. Their powers are
usually invoked with a few words of prayer or by performing
established rituals.Protector: Those who cast miracles are champions of their
particular religions. Good priests vow to protect the innocent,
fight evil, and obey all other tenets of their particular religion.
Evil priests typically vow to defeat those who oppose their
religion, or simply to cause as much misery and strife as
possible. The player and Game Master should come up with
a simple list of what is important to the character’s religion
and use this as a guide.",Faith(Spirit);PP +10;Powers +2,
Arcane Background (Psionics),Background,,"Arcane Skill: Psionics (Smarts)
Starting Power Points: 10
Starting Powers: 3
Psionicists have discovered how to tap into their own psychic
powers. They can manipulate matter, create fire, or control
their own bodies with but a thought.
Brainburn: When a psionic character rolls a 1 on his
Psionics die (regardless of his Wild Die), he is automatically
Shaken. On a critical failure, the psi lets out a psychic scream
that causes him to be Shaken along with all allies in a Large
Burst Template who fail a Spirit roll. This can cause a wound.",Psionics(Smarts);PP +10;Powers +3,
Arcane Background (Weird Science),Background,,"Arcane Skill: Weird Science (Smarts—see below)
Starting Power Points: 10 (but see below)
Starting Powers: 1
Weird Science is the creation of strange and powerful
devices. It differs from regular science in that some element of
the arcane is involved. Maybe it’s just generic “super-science,”
or perhaps it’s divinely (or demonically) inspired. Maybe the
science itself is relatively sound, but it derives power from an
arcane source, such as ghost rock in Deadlands, or some
other magical mineral or essence in a steampunk fantasy
game.
Weird Science is different in that each new power is actually a new “gizmo.” The player must write down exactly what
the device is when he gains the power. An inventor with the
invisibility power, for instance, actually has an invisibility
belt, cloak, etc. Players are encouraged to give their devices
pseudo-scientific names as well (“Dr. Zee’s Chromatic
Disfibulating Device!”).
Weird Science is the skill an inventor uses when activating
most devices, and raises increase the effects of the power
as usual. If a device uses a different skill, such as Driving,
Fighting, or Shooting, the inventor uses that instead. A ray
gun, for example, uses the Shooting skill, while a “vibroknife”
(a knife with the smite power) uses Fighting.
Powers that require an opposed roll, such as puppet, also
use the scientist’s Weird Science skill.
Each device comes with its own Power Points equal to the
inventor’s Power Points. An inventor with the bolt power and
10 Power Points, for example, could make a ray gun that fires
electrical beams. The gun has 10 Power Points it can use
to fire the beams just like a wizard would cast the bolt spell.
Malfunction: Weird science devices are never perfect
technology. They often suffer from spectacular and deadly
malfunctions. If a gadgeteer uses a device and rolls a 1 on
the skill die used to activate the gizmo, it has malfunctioned
in some way and does not work. Draw a card and consult the
Malfunction Table below:",Weird Science(Smarts);PP +10;Powers +1,
Arcane Resistance,Background,Spirit d8,Magic is less effective against you.  Adds +2 to armor when hit by damage causing arcane powers. +2 to Trait rolls when reisting powers.,,
Arcane Resistance (Improved),Background,Arcane Resistance,Magic is greatly less effective against you.  Adds +4 to armor when hit by damage causing arcane powers. +4 to Trait rolls when reisting powers.,,
Attractive,Background,Vigor d6,It's no secret that beautiful people have an easier time getting their way in life. This edge grants you +2 Charisma.,Charisma +2,
Attractive (Very),Background,Attractive,Your hero is drop-dead gorgeous. Your Charisma increases to +4,,
Berserk,Background,,"Immediately after suffering a wound (including a Shaken
result from physical damage), your hero must make a Smarts
roll or go Berserk.
While Berserk, his Parry is reduced by 2 but he adds +2 to all
Fighting, Strength, melee damage rolls, and Toughness. The
warrior ignores all wound modifiers while Berserk, but cannot
use any skills, Edges, or maneuvers that require concentration,
including Shooting and Taunt, but not Intimidation.
Berserkers attack with reckless abandon. Anytime his
Fighting die is a 1 (regardless of his Wild Die), he hits a random
adjacent target (not the original target). The attack may hit
friend as well as foe. If there are no other adjacent targets,
the blow simply misses.
The Berserker may end his rage by doing nothing (not even
moving) for one full action and making a Smarts roll at –2.",,
Brave,Background,Spirit d6,"Those with this Edge have learned to master their fear. Or
perhaps are so jaded or emotionally distant they’ve just lost
their normal “fight or flight” responses. Either way, your hero
adds +2 to Fear tests.",,
Brawny,Background,Strength d6;Vigor d6,Your bulk or fitness resists damage more than most. Add +1 to Toughness. You can also carry 8 times your strength in pounds without penalty (normal is 5 times).,,
Combat Insight,Background,Smarts d8;Spirit d6,"You gain a +2 bonus when making Smarts tricks, and a +1 bonus to Fighting rolls against any opponent you've successfully used a Smarts trick against during the current scene.",,
Fast Healer,Background,Vigor d8,Some individuals just heal faster than others. Those with this blessing add +2 to Vigor rolls when checking for natural healing.,,
Fleet-Footed,Background,Vigor d8,The Hero's Pace is increased by +2 and you roll a d10 instead of a d6 when running.,Pace +2,
Luck,Background,,"Your adventurer is blessed by Karma, fate, the gods, or whatever external forces you believe in (or believe in you)! You gain a benny at the start of each game which may be spent on XP but can't be used to advance your character.",,
Luck (Great),Background,,You gain 2 bennies at the beginning of each session instead of 1.,,
Noble,Background,,"Those born of noble blood have many perks in life, but often
have just as many responsibilities. Nobles have high status
in their societies, are entitled to special treatment from their
foes and gain +2 Charisma. This
gives the hero several Edges for the price of one, but the
responsibilities more than offset the additional perks. Nobles
often have troops under their control, as well as land, a family
home, and other assets. All of this must be determined by the
GM, and balanced by the grave responsibilities the character
faces.
",Charisma +2,
Quick,Background,Agility d8,"Quick characters have lightning-fast reflexes and a cool
head. Whenever you are dealt a 5 or lower in combat, you
may discard and draw again until you get a card higher than 5.
Characters with both the Level Headed and Quick Edges
draw their additional card and take the best as usual. If that
card is a Five or less, the Quick Edge may be used to draw
a replacement until it’s Six or higher.",,
Rich,Background,,"Whether the individual was born with a silver spoon in his
mouth or earned it through hard work, he’s got more money
than most. Rich heroes start with three times the normal
starting funds for the setting. If a regular income is appropriate
for this setting, the hero receives the modern day equivalent
of a $150,000 annual salary",,
Block,Combat,Seasoned;Fighting d8,"Warriors engaging in hand to hand combat are farm more skilled in personal defense than most others. They've learned not only how to attack, but how to block their opponent's blows as well. Add +1 to your Parry.",Parry +1,
Block (Improved),Combat,Veteran;Block,You add +2 to your Parry instead of +1.,Parry +2,
Brawler,Combat,Strength d8,"Frequent fights with bare hands have given this thug a powerful punch. When he hits a foe with a successful bare-handed Fighting roll, he adds +2 to his damage.",,
Bruiser,Combat,Seasoned;Brawler,"When the bruiser gets a raise on his bare-handed Fighting attack, he rolls a d8 instead of a d6.",,
Combat Reflexes,Combat,Seasoned,Your adventurer recovers quickly from shock and trauma. He adds +2 to his Spirit roll when attempting to recover from being Shaken.,,
Counterattack,Combat,Seasoned;Fighting d8,"Fighters with this Edge know how to respond instantly to an
enemy’s mistakes. Once per round, the character receives
one free Fighting attack against one adjacent foe who failed
a Fighting attack against him. This attack is made at –2, and
the Counterattack must be a normal attack (no Disarm, Wild
Attack, or other maneuvers), and may not be combined with
Frenzy or Sweep. It may be used with the Defend maneuver,
but not Full Defense.",,
Counterattack (Improved),Combat,Veteran;Counterattack,"ighters with this Edge know how to respond instantly to an
enemy’s mistakes. Once per round, the character receives
one free Fighting attack against one adjacent foe who failed
a Fighting attack against him. The Counterattack must be a normal attack (no Disarm, Wild
Attack, or other maneuvers), and may not be combined with
Frenzy or Sweep. It may be used with the Defend maneuver,
but not Full Defense. (The improved version removes the -2 penalty on the attack.)",,
Dodge,Combat,Seasoned;Agility d8,"Some crafty types know how to get out of harm’s way. This
Edge allows them to use cover, movement, and concealment
to make them harder to hit. Unless they are the victim of a
surprise attack and taken completely unaware, attackers
must subtract 1 from their Shooting or Throwing rolls when
targeting them.
Characters who attempt to evade area effect attacks may
add +1 to their Agility roll as well (when allowed).",,
Dodge (Improved),Combat,Veteran;Dodge,As dodge but attackers subtract 2 from their attack rolls and the character adds +2 to evade area of effect weapons.,,
Elan,Combat,Spirit d8,"When this spirited hero puts his heart into something, it tends to pay off in big ways. When you spend XP on a trait roll (Including soak rolls), add +2 to the final total.",,
Extraction,Combat,Agility d8,"When a character normally withdraws from a melee,
his attacker gets a free attack before he does so—a very
dangerous proposition for most. Your hero is adept at retreating
from an engagement.
Make an Agility roll. If successful, one opponent doesn’t get
a free attack anytime you disengage.",,
Extraction (Improved),Combat,Extraction,As Extraction but if you succeed with a raise all opponents currently in melee with the character lose their free attack as your warrior withdraws.,,
First Strike,Combat,Agility d8,"Once per turn the hero (if not Shaken) gets a free Fighting
attack against a single foe who moves adjacent to him. This
automatically interrupts the opponent’s action and does not
cost the hero his action if he is on Hold or has not yet acted
this round.",,
First Strike (Improved),Combat,Heroic;First Strike,As First Strike but the hero may make one free attack against each and every foe who moves adjacent to him.,,
Florentine,Combat,Agility d8;Fighting d8,"A character trained to fight “Florentine” is a master at
wielding two weapons at once. He adds +1 to his Fighting
rolls versus an opponent with a single weapon and no shield.
In addition, opponents subtract 1 from any “gang up” bonuses
they would normally get against the fighter as his two flashing
blades parry their blows.",,
Frenzy,Combat,Seasoned;Fighting d10,"Frenzied fighters make fast and furious melee attacks,
sacrificing finesse for raw speed. This allows them to make an
extra Fighting attack per round at a –2 penalty to all Fighting
rolls. This attack must be taken at the same time as another
Fighting attack though it may target any two foes adjacent to
the hero (Wild Cards roll two Fighting dice and one Wild Die).
The –2 penalty is subtracted from all attacks.
A character armed with two weapons still only makes one
extra attack.",,
Frenzy (Improved),Combat,Veteran;Frenzy,As Frenzy but the player ignores the -2 frenzy penalty.,,
Giant Killer,Combat,Veteran;,"The bigger they are, the harder they are to kill. At least for
most. But your hero knows how to find the weak points in
massive creatures.
Your hero does +1d6 damage when attacking creatures
three sizes or more larger than himself. An ogre (Size +3)
with this ability, for example, gains the bonus only against
creatures of Size +6 or greater. A human Giant Killer (Size 0),
can claim the bonus against the ogre, however.",,
Hard to Kill,Combat,Spirit d8,"This adventurer has more lives than a truckload of cats.
When forced to make Vigor rolls due to Incapacitation, he may
ignore his wound modifiers. This only applies to Vigor rolls
called for to resist Incapacitation or death (see page 68). He
still suffers from wound modifiers for other Trait rolls normally.",,
Hard to Kill (Improved),Combat,Veteran;Hard to Kill,"Your character is harder to kill than the legendary Zhova. If he is ever
“killed,” roll a die. On an odd result, he’s dead as usual.
On an even roll, he’s Incapacitated but somehow escapes
death. He may be captured, stripped of all his belongings,
or mistakenly left for dead, but he somehow survives.",,
Improvisational Fighter,Combat,Seasoned;Smarts d6,"Heroes often find themselves fighting with pieces of
equipment or furnishings not designed for combat. A
character with this Edge has a knack for using such
improvised weapons, and does not suffer the usual –1
penalty to attack and Parry when wielding them.",,
Killer Instinct,Combat,Heroic,"This hero hates losing. If he ties on an opposed roll of any
sort, he wins. In addition, if his skill die on an opposed skill
roll is a 1, he can reroll it (but must keep the second result,
even if it’s another 1).",,
Level Headed,Combat,Seasoned;Smarts d8,Fighters who can keep their cool when everyone else is running for cover are deadly customers in combat. A hero with this edge draws an additional action card in combat and acts on the best draw.,,
Level Headed (Improved),Combat,"Seasoned, Level Headed",As Level Headed but the hero draws 3 cards.,,
Martial Artist,Combat,Fighting d6,"This character is highly trained in hand-to-hand fighting.
He is never considered unarmed in combat and so is never
subject to the Unarmed Defender rule. With a
successful unarmed attack, he adds +d4 to his Strength roll
(as if he were using a small weapon).",,
Martial Artist (Improved),Combat,Veteran;Martial Arts;Fighting d10,The character now adds +d6 to their bare-handed damage.,,
Nerves of Steel,Combat,Vigor d6,Your hero has learned to fight on through the most intense pain. She may ignore 1 point of wound penalties.,,
Nerves of Steel (Improved),Combat,Nerves of Steel,Your hero ignores 2 points of wound penalties.,,
No Mercy,Combat,Seasoned,"The character may spend an XP to reroll any one damage roll, including those made for area effect attacks.",,
Quick Draw,Combat,Agility d8,"This edge allows a hero to draw a weapon as a free action and ignore the usual -2 multi action penalty if she would choose to take any other action. If a character must roll to draw the weapon, she adds +2 to the roll.",,
Rock and Roll!,Combat,Seasoned;Shooting d8,"Some Veteran shooters learn to compensate for the recoil of fully automatic weapons. If a character with this Edge does not move, he may ignore the recoil penalty for firing a weapon on full auto.",,
Steady Hands,Combat,Agility d8,"Your hero ignores the ""unstable platform"" penalty for firing from the backs of animals or while riding in moving vehicles. In addition, when performing actions while running, his penalty is -1 instead of -2.",,
Sweep,Combat,Agility d8,"Sweep allows a character to make a single Fighting attack
and apply it against all currently adjacent targets at a –2
penalty (friends and foes alike—be careful). Resolve each
damage roll separately. The attack is applied immediately
when rolled and only affects targets adjacent at that time.
A character may not use Sweep in the same round she
uses Frenzy, nor may she Sweep more than once per round,
or with a second weapon held in another hand. In effect, the
hero may only perform Sweep once per action unless she
somehow gets two entire actions (perhaps under the effects
of a spell or power, for example).",,
Sweep (Improved),Combat,"Veteran, Sweep",As sweep but you may ignore the -2 penalty.,,
Trademark Weapon,Combat,Fighting d10 or Shooting d10,"The hero knows one unique weapon (Excalibur, Old Betsy,
Sting) like the back of his hand. When using that weapon, he
adds +1 to his Fighting, Shooting, or Throwing rolls. A hero can take this Edge multiple times, applying it to a different
weapon each time. If a Trademark Weapon is lost, the hero
can replace it, but the benefit of the Edge doesn’t kick in for
two game weeks.
",,
Trademark Weapon (Improved),Combat,Veteran;Trademark Weapon,As Trademark Weapon but the bonus when using the weapon increases to +2.,,
Two-Fisted,Combat,Agility d8,"A Two-Fisted hero isn’t ambidextrous—he’s simply learned to
fight with two weapons (or both fists) at once. When attacking
with a weapon in each hand, he rolls each attack separately
but ignores the multi-action penalty (see page 66).",,
Command,Leadership,Smarts d6,"Command is the ability to give clear instructions to
surrounding allies and enforce your hero’s will upon them.
This makes your character’s compatriots more willing to fight
on despite their wounds, and so adds +1 to their Spirit rolls
to recover from being Shaken.",,
Command Presense,Leadership,Command,"A booming voice, effective commands, natural charisma,
or simple training results in a much more effective combat
element. At the center of that element is the officer in
command. A hero with this Edge has a “command radius” of
10” instead of the usual 5”.",,
Fervor,Leadership,Command;Spirit d6,"A simple phrase uttered by a great leader can sometimes
have momentous results. A leader with this ability can inspire
his men to bloody fervor by yelling a motto, slogan, or other
inspirational words. Those in the command radius add +1 to
their Fighting damage rolls.",,
Hold the Line!,Leadership,Seasoned;Command;Smarts d8,"This Edge strengthens the will of the men under the hero’s
command. The troops add +1 to their Toughness.",,
Inspire,Leadership,Seasoned;Command,"Leaders with exceptional reputations and experience in
battle inspire the soldiers around them. They add +2 to Spirit
rolls when recovering from being Shaken (this includes the
original +1 bonus for the Command Edge).",,
Leader of Men,Leadership,Veteran;Command,"Allies under the leader’s command roll a d10 as the Wild
Die instead of a d6 when making group rolls.",,
Natural Leader,Leadership,Command;Spirit d8,"This Edge signifies a special link between a leader and his
men. With it, he may share his XP with any troops under
his command.",,
Tactician,Leadership,Seasoned;Command;Smarts d8;Knowledge(Battle) d6,"The leader has a natural grasp of small unit tactics and can
frequently take advantage of a rapidly changing situation.
At the beginning of a fight and before any Action Cards are
dealt, the hero makes a Knowledge (Battle) roll. For each
success and raise he receives one Action Card. These are
kept separate from his regular Action Cards and are not placed
back into the deck until used or the combat ends (including
Jokers!). At the start of any round, the hero may give one or
more of these extra cards to his allies, whether Extras or Wild
Cards, who then use it as their Action Card for the round in
place of the one dealt them. This allows Extras to operate
independently of Wild Card characters for one round if they
receive their own card.
Only one character per encounter may use this Edge.",,
New Power,Power,Arcane Background,You select a new power to cast.,,
Power Points,Power,Arcane Background,Gain an additional 5 power points.,PP 5,PP +5
Rapid Recharge,Power,Seasoned;Spirit d6;Arcane Background,This edge allows an arcane character to regain 1 power point every 30 minutes.,,
Rapid Recharge (Improved),Power,Veteran;Rapid Recharge,This character gains 1 power point every 15 minutes.,,
Soul Drain,Power,Seasoned;Arcane Background;Knowledge (Arcana) d10,"Spellcasters, mentalists, and other arcane types in dire need
of Power Points may use this Edge to drain energy from their
own souls. To use this dangerous ability, the arcane character
first decides how many Power Points he wants to draw from
himself. Then he makes a Spirit roll minus the number of points
he’s trying to drain. (This is a free action.) On a Spirit total of
1 or less, the character suffers a wound and falls unconscious
for 1d6 hours. On a failure, the character suffers a wound. On
a success or better, the character gets the points he needed
and may attempt to cast a spell with them immediately (they
may not be saved).",,
Ace,Professional,Agility d8,"Aces are special pilots and drivers who feel more
comfortable behind the wheel, throttle, or flight stick than on
their own two feet.
Aces add +2 to Boating, Driving, and Piloting rolls. In
addition, they may also spend Bennies to make Soak rolls for
any vehicle or vessel they control. This is a Boating, Driving,
or Piloting roll at –2 (cancelling their usual +2). Each success
and raise negates a wound and any critical hit that would
have resulted from it.",,
Acrobat,Professional,Agility d8;Strength d6,"Those who have formal training in the acrobatic arts or are
naturally agile may take this Edge. It adds +2 to all Agility
rolls made to perform acrobatic maneuvers (including Trick
maneuvers), and also adds +1 to a character’s Parry as long
as he has no encumbrance penalty.",,
Adept,Professional,Arcane Background (Miracles);Faith d8;Fighting d8,"Adepts are holy warriors who have trained themselves to be living weapons. Some do so to be ultimate warriors; others
do it in the service of a cause or deity.
Their unarmed attacks do Str+d4 damage, and they are
always considered armed for purposes of the Unarmed
Defender rule.
In addition, upon taking this Edge and at each new Rank,
they may choose to change the trappings of one of the
following powers to work only on themselves but be activated
as a free action: boost/lower trait, deflection, healing, smite, or
speed. The Adept must have the power to begin with, and this
does not allow him to activate more than one power in a round.",,
Assassin,Professional,Agility d8;Climbing d6;Fighting d6;Stealth d8,"Assassins are trained killers who know how to kill with deadly
precision — if they can properly approach their prey. Assassins
add +2 to any damage roll where they strike a foe unawares
(even with ranged attacks).",,
Bard,Professional,Charismatic;Persuasion d8;Knowledge (Bardic Lore) d6,"You are a talented musician and entertainer. You gain the Command Edge, representing your ability to inspire people with your songs - you must sing or play an instrument in order to use Command, but the benefits applies to all allies within range, rather than just subordinates. The same trapping extends to any other Leadership Edges you take. If you take Tactician, replace Knowledge (Battle) with Knowledge (Bardic Lore).
  If you wish to take Jack-of-all-Trades, you may ignore the Smarts requirement. If you wish to take Attractive and Very Attractive during play, you can have it represent the attraction of your growing celebrity status.",Command,
Bounty Hunter,Professional,Investigation d6;Streetwise d6;Fighting d8 or Shooting d8 or Throwing d8,"You've had plenty of practice finding and capturing wanted criminals. You can choose to inflict nonlethal damage without incurring any additional penalties to your attack rolls, as long as you have at least d8 in the associated combat skill. You must still declare your intent to inflict nonlethal damage before making your attack roll. You also gain a +2 bonus to Investigation and Streetwise rolls related to discovering information about criminals.",,
