Edge,rank,prerequisites,description,numerical effect,
Champion,Professional,Arcane Background (Miracles);Spirit d8;Strength d6;Vigor d8;Faith d6;Fighting d8,"Champions are holy (or unholy) men and
women chosen to fight for a particular
deity or religion. Most are pious souls
ready and willing to lay down their
lives for a greater cause, but some
may have been born into the role
and follow their path with some
reluctance.
Champions fight the
forces of darkness (or
good). They add +2
damage when attacking
supernaturally evil (or
good) creatures, and
have +2 Toughness
when suffering damage
from supernaturally
evil (or good) sources,
including arcane powers
and the weapons, claws, teeth, etc.,
of such creatures.",,
Favoured Enemy,Professional,Smarts d8,"You've made a career out of studying and hunting a certain type of creature. You gain a +2 bonus to all Taunt, Investigation and Knowledge rolls (including Common Knowledge) against or related to one type of creature, such as humans, robots, Frames, etc, chosen when this Edge is taken. You also halve the penalties for making called shots against your favoured enemy.
",,
Gadgeteer,Professional,Arcane Background (Weird Science);Smarts d8;Repair d8;Weird Science d8;Two knowledges at d6,"These mechanical gurus are so
technically savvy they can quickly build
a machine to handle nearly any situation.
Once per game session, a gadgeteer can create a “juryrigged”
device from spare parts. The device functions just like
any other Weird Science device, and uses any power available to Weird Scientists in that setting (though this is still subject
to Rank restrictions). It has half the inventor’s Power Points,
and once these are used up, the gadget burns out and does
not recharge. The inventor must have access to some parts
and a reasonable amount of time (GM’s call, but at least 1d20
minutes) to create the gizmo.",,
Holy/Unholy Warrior,Professional,Arcane Background (Miracles);Spirit d8;Faith d6,"Acolytes, clerics, paladins, holy slayers, and other avatars of
the gods are frequently tasked with battling the forces of evil
in the mortal world. This Edge gives them a slight advantage
against such foes.
As an action, a priest or other holy person may call upon
his chosen deity to repulse supernaturally evil creatures,
such as the undead, demons, and the like. It also works on
evil characters with the Arcane Background (Miracles) Edge.
Repulsing evil costs 1 Power Point and has a range of
the character’s Spirit. Targeted creatures within that range
must make a Spirit roll. Failure means the creature is
Shaken; a 1 means it is destroyed. Wild
Cards suffer an automatic Wound
instead.
A character may also be an Unholy
Warrior working for the forces of
evil. In this case, he repulses
good creatures, such as angels,
paladins, or good characters
with Arcane Background
(Miracles).",,
Investigator,Professional,Smarts d8;Investigation d8;Streetwise d8,"Investigators have spent a great deal of time
researching ancient legends, working
the streets, or deducing devilish
mysteries. Some of these heroes
are actual Private Investigators
for hire while others may be
sleuthing mages in a fantasy
world or perhaps inquisitive
college professors stumbling
upon Things Man Was Not
Meant to Know in the dark of
night. Investigators add +2 to
Investigation and Streetwise rolls, as
well as Notice rolls made to search through
evidence.",,
Jack-of-All-Trades,Professional,Smarts d10,"Through advanced schooling, book-learning,
computer-enhanced skill programs, or just
amazing intuitive perception, your hero has
a talent for picking up skills on the fly. There
is little he can’t figure out given a little time
and a dash of luck. Anytime he makes an unskilled roll for a Smarts-based skill, he may do so at a d4 instead of a d4 - 2.",,
McGyver,Professional,Smarts d6;Repair d6;Notice d8,"This character can improvise something when the need for
a tool arises. He suffers no negative penalties on Trait rolls
for lack of equipment in most situations.
In addition, given a few simple tools, props, or devices, he
can generally rig devices to help escape from death-traps,
weapons to match some bizarre need, or otherwise create
something that’s needed when such a thing isn’t actually
present. The extent of this is completely up to the Game
Master, but creativity should be rewarded, particularly in dire
situations where few other answers are possible.",,
Mentalist,Professional,Arcane Background (Psionics);Smarts d8;Psionics d6,"Mentalists are masters of mind control and psionics. Some
are pulp heroes, others are trained in secret government
academies to root out traitors. Their frequent toying with
human minds gives them a +2 on any opposed Psionics roll,
whether they are using their powers against a foe or are trying
to defend against a rival Mentalist.",,
Mr. Fix It,Professional,Arcane Background (Weird Science);Smarts d10;Repair d8;Weird Science d8;Two knowledge skills at d8,"The inventor adds +2 to Repair rolls. With a raise, he halves
the time normally required to fix something. This means that
if a particular Repair job already states that a raise repairs it
in half the time, a Mr. Fix It could finish the job in one-quarter
the time with a raise.",,
Scholar,Professional,Skill of Choice d8;Skill of Choice d8,"Learned professors, devoted students, and amateur
enthusiasts spend months of their lives studying particular
subjects. They become experts in these fields, and rarely
fail to answer questions in their particular area of expertise.
Pick any two Knowledge skills the Scholar has a d8 or
better in. Add +2 to your total whenever these skills are used.
Those who study military history have a natural edge when
commanding troops in Mass Battles (see page 92)—a +2 to
a Knowledge (Battle) roll can mean the difference between
a rousing victory and a crushing defeat.",,
Thief,Professional,Agility d8;Climbing d6;Lockpicking d6;Stealth d8,"Thieves specialize in deceit, treachery, and acrobatics. They
can be invaluable where traps must be detected, walls must
be climbed, and locks must be picked.
Thieves add +2 to Climbing, Lockpick, Stealth, as well as
Notice or Repair rolls that relate to traps and similar devices.
The bonus to Stealth does not apply when the character is in
a wilderness environment—only in urban areas.",,
Wizard,Professional,Arcane Background (Magic);Smarts d8;Knowledge (Arcana) d8; Spellcasting d6,"Wizards range from young apprentices to frighteningly
powerful supreme sorcerers. They are often physically weak,
however, and rarely have the divine powers or healing abilities
of priestly spellcasters. What they lack in spiritual favor,
however, they more than make up for in utility and eldritch
might.
Wizards tend to learn their craft in formalized institutions
or under the tutelage of experienced masters. Each raise a
Wizard gets on his Spellcasting roll reduces the cost of the
spell by 1 Power Point. The Wizard must have the points
available to cast the spell in the first place before rolling.",,
Woodsman,Professional,Spirit d6;Survival d8;Tracking d8,"Woodsmen are rangers, scouts, and hunters who are more
at home in the wilderness than in urban areas. They are skilled
trackers and scouts, and know how to live off the land for
months at a time. Woodsmen gain +2 to Tracking, Survival,
and Stealth rolls made in the wilderness (not towns, ruins, or
underground).",,
Charismatic,Social,Spirit d8,"Your hero has learned how to work with others, even those
who might be somewhat opposed to him or his efforts. This
adds +2 to his Charisma.",Charisma +2,
Common Bond,Social,Spirit d8,"This Edge signifies a special link between close companions—
such as a typical party. It doesn’t matter whether or not the
characters get along perfectly or not, they’ve just formed a
close and common bond during their epic adventures.
A character with this Edge may freely give his Bennies to any
other Wild Card he can communicate with. This represents
the character giving his verbal or spiritual support to the ally.
The player should say what his character is doing to give
the support. The gesture could be as complex as a rousing
speech, or as simple as a knowing nod.",,
Connections,Social,,TO FILL IN! SPECIAL!,,
Strong Willed,Social,Intimidation d6;Taunt d6,"Characters with strong willpower use their voice, steely
stares, or quick wits to unnerve their opponents. Strong Willed
adds +2 to a character’s Intimidation and Taunt rolls, as well as
his Spirit and Smarts rolls when resisting Test of Wills attacks.",,
Beast Bond,Weird,,"Some individuals can exert incredible will over their animal
companions. These characters may spend their own Bennies
for any animals under their control, including mounts, pet
dogs, familiars, and so on.",,
Beast Master,Weird,Spirit d8,"Animals like your hero, and won’t attack him unless he
attacks them first or they are enraged for some reason. His
“animal magnetism” is so great he’s attracted a loyal animal
of some sort as well. This is typically a dog, wolf, or raptor,
though the GM may allow other companions if it fits the setting.
The beast is an Extra (not a Wild Card). If it should be killed,
the hero finds a replacement in 2d6 days.",,
Danger Sense,Weird,,"Your hero can sense when something bad is about to
happen. Anytime he’s about to be the victim of a surprise
attack, ambush, or other nasty surprise, he gets a Notice roll
at –2 just before the attack or event occurs. If successful,
the character knows something is about to happen and may
take appropriate action against it. This means the hero is on
Hold for the first round of a combat. Should the hero fail his
roll, he still follows the normal Surprise rules, if applicable
(see page 65).",,
Healer,Weird,Spirit d8,"A hero with this Edge adds +2 to all Healing rolls (including
natural healing rolls for his own wounds), whether natural
or magical in nature. Up to five companions traveling with a
Healer add the bonus to their natural healing rolls as well.",,
Liquid Courage,Weird,Vigor d8,"Your hero processes alcohol far differently than most. The
round after consuming a stiff drink (at least 8 ounces of hard
liquor or equivalent), the character’s Vigor increases by one
die type (increasing Toughness as well). The hard drinker can
also ignore one level of wound modifiers (which stacks with
other abilities that do the same).
The effect lasts for one hour after it begins. If the drunkard
seeks inebriation he suffers –2 to Smarts and Agility-based
rolls for as long as he continues to drink and the next 1d6
hours thereafter.",,
Scavenger,Weird,Luck,"Once per session the hero may “suddenly remember” that
he has a much-needed piece of equipment on his person. The
item must be capable of being stored in the hero’s pocket or
bag (assuming he has one), and the Game Master has the
final word on what can be found.",,
Dead Shot,Wild Card,Seasoned;Shooting d10 or Throwing d10,"The character doubles his total damage when making a
successful Shooting or Throwing attack this round.",,
Mighty Blow,Wild Card,Seasoned;Fighting d10,"The character doubles his total damage when making a
successful Fighting attack this round.",,
Power Surge,Wild Card,Seasoned;Arcane Skill d10,"This Edge is for those characters with Arcane Backgrounds.
When dealt a Joker, the character recovers 2d6 Power Points.
He may not exceed his usual limit.",,